[
  {
    "fact_id": "fact-price-veh001-2026-08-20",
    "entity_type": "PRICE",
    "entity_id": "veh-001",
    "field": "price",
    "value": 85000,
    "source_system": "HUMAN_MAINTAINED_SOURCE",
    "verified_at": "2026-08-20T09:00:00Z",
    "expires_at": null,
    "status": "CONFIRMED"
  },
  {
    "fact_id": "fact-mileage-veh001-2026-08-20",
    "entity_type": "VEHICLE",
    "entity_id": "veh-001",
    "field": "mileage",
    "value": 42000,
    "source_system": "HUMAN_MAINTAINED_SOURCE",
    "verified_at": "2026-08-20T09:00:00Z",
    "status": "CONFIRMED"
  }
]
